0702ConvData/LibraryLogic/arcturus_Cijk_Ailk_Bljk_HH.yaml
- {MinimumRequiredVersion: 4.20.0}
- arcturus
- gfx908
- [Device 7380, Device 7388, Device 738c, Device 7390]
- - - [64, 192, 64, 1280]
    - [30, 40073.0]
  - - [64, 320, 64, 1280]
    - [46, 48545.0]
  - - [64, 384, 64, 1280]
    - [39, 55188.0]
  - - [64, 448, 64, 1280]
    - [48, 55818.0]
  - - [64, 192, 64, 2048]
    - [49, 43577.0]
  - - [64, 320, 64, 2048]
    - [47, 52347.0]
  - - [64, 384, 64, 2048]
    - [35, 53687.0]
  - - [64, 448, 64, 2048]
    - [48, 60149.0]
  - - [1225, 32, 64, 192]
    - [18, 17554.0]
  - - [1225, 48, 64, 192]
    - [7, 17571.0]
  - - [1225, 64, 64, 192]
    - [15, 26408.0]
  - - [1225, 48, 64, 256]
    - [15, 21127.0]
  - - [1225, 64, 64, 256]
    - [8, 30759.0]
  - - [1225, 48, 64, 288]
    - [13, 21676.0]
  - - [1225, 64, 64, 288]
    - [21, 33083.0]
  - - [5329, 80, 64, 64]
    - [3, 16014.0]
  - - [289, 128, 64, 768]
    - [20, 38918.0]
  - - [289, 160, 64, 768]
    - [5, 35512.0]
  - - [289, 192, 64, 768]
    - [14, 41677.0]
  - - [64, 192, 32, 1280]
    - [37, 29537.0]
  - - [64, 320, 32, 1280]
    - [32, 38409.0]
  - - [64, 384, 32, 1280]
    - [38, 43691.0]
  - - [64, 448, 32, 1280]
    - [43, 45732.0]
  - - [64, 192, 32, 2048]
    - [22, 29870.0]
  - - [64, 320, 32, 2048]
    - [50, 38657.0]
  - - [64, 384, 32, 2048]
    - [40, 42119.0]
  - - [64, 448, 32, 2048]
    - [51, 50296.0]
  - - [1225, 32, 32, 192]
    - [11, 14904.0]
  - - [1225, 48, 32, 192]
    - [7, 16362.0]
  - - [1225, 64, 32, 192]
    - [10, 23158.0]
  - - [1225, 48, 32, 256]
    - [4, 17154.0]
  - - [1225, 64, 32, 256]
    - [14, 24778.0]
  - - [1225, 48, 32, 288]
    - [1, 18407.0]
  - - [1225, 64, 32, 288]
    - [16, 26880.0]
  - - [5329, 80, 32, 64]
    - [1, 15012.0]
  - - [289, 128, 32, 768]
    - [3, 35292.0]
  - - [289, 160, 32, 768]
    - [6, 29228.0]
  - - [289, 192, 32, 768]
    - [0, 32593.0]
  - - [3136, 256, 64, 64]
    - [35, 32936.0]
  - - [3136, 64, 64, 64]
    - [34, 21634.0]
  - - [3136, 64, 64, 256]
    - [36, 38632.0]
  - - [784, 512, 64, 128]
    - [35, 39035.0]
  - - [784, 128, 64, 512]
    - [42, 48188.0]
  - - [196, 1024, 64, 256]
    - [29, 42862.0]
  - - [196, 256, 64, 1024]
    - [25, 59313.0]
  - - [49, 2048, 64, 512]
    - [2, 35283.0]
  - - [49, 512, 64, 2048]
    - [2, 32519.0]
  - - [3136, 256, 32, 64]
    - [35, 30538.0]
  - - [3136, 64, 32, 64]
    - [31, 18890.0]
  - - [3136, 64, 32, 256]
    - [33, 34716.0]
  - - [784, 512, 32, 128]
    - [35, 36120.0]
  - - [784, 128, 32, 512]
    - [44, 42115.0]
  - - [196, 1024, 32, 256]
    - [26, 37849.0]
  - - [196, 256, 32, 1024]
    - [24, 42996.0]
  - - [49, 2048, 32, 512]
    - [9, 30358.0]
  - - [49, 512, 32, 2048]
    - [5, 28426.0]
  - - [3136, 128, 64, 64]
    - [35, 28744.0]
  - - [3136, 256, 64, 128]
    - [34, 46159.0]
  - - [784, 512, 64, 256]
    - [35, 52262.0]
  - - [3136, 128, 64, 256]
    - [34, 52935.0]
  - - [3136, 256, 64, 256]
    - [34, 58036.0]
  - - [196, 1024, 64, 512]
    - [27, 56578.0]
  - - [784, 256, 64, 512]
    - [45, 56578.0]
  - - [784, 512, 64, 512]
    - [45, 68707.0]
  - - [196, 512, 64, 1024]
    - [28, 65505.0]
  - - [196, 1024, 64, 1024]
    - [28, 70354.0]
  - - [49, 2048, 64, 1024]
    - [17, 41207.0]
  - - [49, 1024, 64, 2048]
    - [12, 39946.0]
  - - [3136, 128, 32, 64]
    - [41, 25819.0]
  - - [3136, 256, 32, 128]
    - [34, 43359.0]
  - - [784, 512, 32, 256]
    - [35, 48992.0]
  - - [3136, 128, 32, 256]
    - [34, 48188.0]
  - - [3136, 256, 32, 256]
    - [34, 56501.0]
  - - [196, 1024, 32, 512]
    - [23, 49168.0]
  - - [784, 256, 32, 512]
    - [45, 52630.0]
  - - [784, 512, 32, 512]
    - [45, 57690.0]
  - - [196, 512, 32, 1024]
    - [28, 59399.0]
  - - [196, 1024, 32, 1024]
    - [23, 66458.0]
  - - [49, 2048, 32, 1024]
    - [19, 36025.0]
  - - [49, 1024, 32, 2048]
    - [17, 31790.0]
- null
