0702ConvData/LibraryLogic/arcturus_Cijk_Ailk_Bljk_BH.yaml
- {MinimumRequiredVersion: 4.20.0}
- arcturus
- gfx908
- [Device 7380, Device 7388, Device 738c, Device 7390]
- - - [64, 192, 64, 1280]
    - [33, 37228.0]
  - - [64, 320, 64, 1280]
    - [36, 36283.0]
  - - [64, 384, 64, 1280]
    - [35, 43615.0]
  - - [64, 448, 64, 1280]
    - [42, 47432.0]
  - - [64, 192, 64, 2048]
    - [39, 38058.0]
  - - [64, 320, 64, 2048]
    - [37, 37744.0]
  - - [64, 384, 64, 2048]
    - [35, 45293.0]
  - - [64, 448, 64, 2048]
    - [41, 50840.0]
  - - [1225, 32, 64, 192]
    - [19, 16866.0]
  - - [1225, 48, 64, 192]
    - [2, 17105.0]
  - - [1225, 64, 64, 192]
    - [1, 23941.0]
  - - [1225, 48, 64, 256]
    - [3, 18728.0]
  - - [1225, 64, 64, 256]
    - [15, 27973.0]
  - - [1225, 48, 64, 288]
    - [8, 20011.0]
  - - [1225, 64, 64, 288]
    - [9, 29906.0]
  - - [5329, 80, 64, 64]
    - [4, 14829.0]
  - - [289, 128, 64, 768]
    - [13, 34126.0]
  - - [289, 160, 64, 768]
    - [12, 31254.0]
  - - [289, 192, 64, 768]
    - [12, 37838.0]
  - - [64, 192, 32, 1280]
    - [30, 27962.0]
  - - [64, 320, 32, 1280]
    - [21, 32264.0]
  - - [64, 384, 32, 1280]
    - [33, 37009.0]
  - - [64, 448, 32, 1280]
    - [29, 39891.0]
  - - [64, 192, 32, 2048]
    - [20, 28679.0]
  - - [64, 320, 32, 2048]
    - [45, 33689.0]
  - - [64, 384, 32, 2048]
    - [40, 38348.0]
  - - [64, 448, 32, 2048]
    - [44, 43496.0]
  - - [1225, 32, 32, 192]
    - [11, 14405.0]
  - - [1225, 48, 32, 192]
    - [7, 15360.0]
  - - [1225, 64, 32, 192]
    - [0, 21895.0]
  - - [1225, 48, 32, 256]
    - [14, 16725.0]
  - - [1225, 64, 32, 256]
    - [8, 22425.0]
  - - [1225, 48, 32, 288]
    - [7, 17826.0]
  - - [1225, 64, 32, 288]
    - [0, 25805.0]
  - - [5329, 80, 32, 64]
    - [4, 13974.0]
  - - [289, 128, 32, 768]
    - [8, 29364.0]
  - - [289, 160, 32, 768]
    - [17, 26903.0]
  - - [289, 192, 32, 768]
    - [16, 29905.0]
  - - [3136, 256, 64, 64]
    - [32, 29402.0]
  - - [3136, 64, 64, 64]
    - [28, 19244.0]
  - - [3136, 64, 64, 256]
    - [34, 36931.0]
  - - [784, 512, 64, 128]
    - [35, 35192.0]
  - - [784, 128, 64, 512]
    - [43, 43868.0]
  - - [196, 1024, 64, 256]
    - [27, 39868.0]
  - - [196, 256, 64, 1024]
    - [23, 42862.0]
  - - [49, 2048, 64, 512]
    - [10, 32622.0]
  - - [49, 512, 64, 2048]
    - [6, 28906.0]
  - - [3136, 256, 32, 64]
    - [35, 26971.0]
  - - [3136, 64, 32, 64]
    - [21, 17417.0]
  - - [3136, 64, 32, 256]
    - [22, 32674.0]
  - - [784, 512, 32, 128]
    - [32, 31913.0]
  - - [784, 128, 32, 512]
    - [34, 38705.0]
  - - [196, 1024, 32, 256]
    - [27, 36120.0]
  - - [196, 256, 32, 1024]
    - [26, 38487.0]
  - - [49, 2048, 32, 512]
    - [13, 28584.0]
  - - [49, 512, 32, 2048]
    - [18, 21934.0]
  - - [3136, 128, 64, 64]
    - [38, 25819.0]
  - - [3136, 256, 64, 128]
    - [34, 40879.0]
  - - [784, 512, 64, 256]
    - [32, 46107.0]
  - - [3136, 128, 64, 256]
    - [34, 47382.0]
  - - [3136, 256, 64, 256]
    - [34, 50919.0]
  - - [196, 1024, 64, 512]
    - [27, 47138.0]
  - - [784, 256, 64, 512]
    - [35, 49197.0]
  - - [784, 512, 64, 512]
    - [35, 52245.0]
  - - [196, 512, 64, 1024]
    - [24, 48788.0]
  - - [196, 1024, 64, 1024]
    - [25, 51316.0]
  - - [49, 2048, 64, 1024]
    - [5, 37762.0]
  - - [49, 1024, 64, 2048]
    - [13, 36327.0]
  - - [3136, 128, 32, 64]
    - [38, 22243.0]
  - - [3136, 256, 32, 128]
    - [32, 38632.0]
  - - [784, 512, 32, 256]
    - [35, 43268.0]
  - - [3136, 128, 32, 256]
    - [31, 43086.0]
  - - [3136, 256, 32, 256]
    - [34, 48788.0]
  - - [196, 1024, 32, 512]
    - [25, 43774.0]
  - - [784, 256, 32, 512]
    - [46, 46236.0]
  - - [784, 512, 32, 512]
    - [32, 50096.0]
  - - [196, 512, 32, 1024]
    - [24, 43041.0]
  - - [196, 1024, 32, 1024]
    - [25, 49080.0]
  - - [49, 2048, 32, 1024]
    - [10, 33445.0]
  - - [49, 1024, 32, 2048]
    - [18, 28545.0]
- null
