0702ConvData/LibraryLogic/arcturus_Cijk_Ailk_Bjlk_HH.yaml
- {MinimumRequiredVersion: 4.20.0}
- arcturus
- gfx908
- [Device 7380, Device 7388, Device 738c, Device 7390]
- - - [64, 1280, 64, 192]
    - [24, 41121.0]
  - - [64, 1280, 64, 320]
    - [29, 48210.0]
  - - [64, 1280, 64, 384]
    - [29, 52211.0]
  - - [64, 1280, 64, 448]
    - [29, 54879.0]
  - - [64, 2048, 64, 192]
    - [23, 41769.0]
  - - [64, 2048, 64, 320]
    - [33, 51150.0]
  - - [64, 2048, 64, 384]
    - [29, 53616.0]
  - - [64, 2048, 64, 448]
    - [26, 55858.0]
  - - [1225, 192, 64, 32]
    - [9, 15399.0]
  - - [1225, 192, 64, 48]
    - [9, 13440.0]
  - - [1225, 192, 64, 64]
    - [0, 24230.0]
  - - [1225, 256, 64, 48]
    - [10, 14561.0]
  - - [1225, 256, 64, 64]
    - [3, 24626.0]
  - - [1225, 288, 64, 48]
    - [1, 12890.0]
  - - [1225, 288, 64, 64]
    - [3, 22028.0]
  - - [5329, 64, 64, 80]
    - [1, 17560.0]
  - - [289, 768, 64, 128]
    - [6, 30548.0]
  - - [289, 768, 64, 160]
    - [6, 34731.0]
  - - [289, 768, 64, 192]
    - [6, 38873.0]
  - - [64, 1280, 32, 192]
    - [12, 31936.0]
  - - [64, 1280, 32, 320]
    - [31, 40486.0]
  - - [64, 1280, 32, 384]
    - [27, 42799.0]
  - - [64, 1280, 32, 448]
    - [35, 44351.0]
  - - [64, 2048, 32, 192]
    - [22, 35074.0]
  - - [64, 2048, 32, 320]
    - [29, 42582.0]
  - - [64, 2048, 32, 384]
    - [29, 45242.0]
  - - [64, 2048, 32, 448]
    - [26, 46976.0]
  - - [1225, 192, 32, 32]
    - [9, 12440.0]
  - - [1225, 192, 32, 48]
    - [9, 11699.0]
  - - [1225, 192, 32, 64]
    - [3, 20411.0]
  - - [1225, 256, 32, 48]
    - [9, 13061.0]
  - - [1225, 256, 32, 64]
    - [5, 22177.0]
  - - [1225, 288, 32, 48]
    - [9, 12074.0]
  - - [1225, 288, 32, 64]
    - [3, 20026.0]
  - - [5329, 64, 32, 80]
    - [1, 16289.0]
  - - [289, 768, 32, 128]
    - [9, 27317.0]
  - - [289, 768, 32, 160]
    - [3, 30288.0]
  - - [289, 768, 32, 192]
    - [2, 32718.0]
  - - [3136, 64, 64, 256]
    - [27, 40377.0]
  - - [3136, 64, 64, 64]
    - [13, 24409.0]
  - - [3136, 256, 64, 64]
    - [25, 35805.0]
  - - [784, 128, 64, 512]
    - [28, 56774.0]
  - - [784, 512, 64, 128]
    - [28, 44678.0]
  - - [196, 256, 64, 1024]
    - [15, 59313.0]
  - - [196, 1024, 64, 256]
    - [21, 45419.0]
  - - [49, 512, 64, 2048]
    - [5, 34599.0]
  - - [49, 2048, 64, 512]
    - [7, 36537.0]
  - - [3136, 64, 32, 256]
    - [22, 37367.0]
  - - [3136, 64, 32, 64]
    - [31, 19462.0]
  - - [3136, 256, 32, 64]
    - [24, 31473.0]
  - - [784, 128, 32, 512]
    - [36, 50621.0]
  - - [784, 512, 32, 128]
    - [32, 36700.0]
  - - [196, 256, 32, 1024]
    - [16, 45369.0]
  - - [196, 1024, 32, 256]
    - [18, 38487.0]
  - - [49, 512, 32, 2048]
    - [11, 32571.0]
  - - [49, 2048, 32, 512]
    - [0, 30905.0]
  - - [3136, 64, 64, 128]
    - [34, 31045.0]
  - - [3136, 128, 64, 256]
    - [28, 60182.0]
  - - [784, 256, 64, 512]
    - [25, 71114.0]
  - - [3136, 256, 64, 128]
    - [25, 56153.0]
  - - [3136, 256, 64, 256]
    - [25, 76366.0]
  - - [196, 512, 64, 1024]
    - [20, 68450.0]
  - - [784, 512, 64, 256]
    - [28, 63481.0]
  - - [784, 512, 64, 512]
    - [25, 77227.0]
  - - [196, 1024, 64, 512]
    - [18, 58304.0]
  - - [196, 1024, 64, 1024]
    - [17, 73237.0]
  - - [49, 1024, 64, 2048]
    - [4, 43290.0]
  - - [49, 2048, 64, 1024]
    - [4, 44582.0]
  - - [3136, 64, 32, 128]
    - [30, 27042.0]
  - - [3136, 128, 32, 256]
    - [25, 52698.0]
  - - [784, 256, 32, 512]
    - [25, 60270.0]
  - - [3136, 256, 32, 128]
    - [25, 47851.0]
  - - [3136, 256, 32, 256]
    - [25, 69668.0]
  - - [196, 512, 32, 1024]
    - [14, 59228.0]
  - - [784, 512, 32, 256]
    - [25, 56230.0]
  - - [784, 512, 32, 512]
    - [25, 71860.0]
  - - [196, 1024, 32, 512]
    - [20, 53591.0]
  - - [196, 1024, 32, 1024]
    - [19, 67329.0]
  - - [49, 1024, 32, 2048]
    - [8, 33914.0]
  - - [49, 2048, 32, 1024]
    - [4, 37710.0]
- null
