0702ConvData/LibraryLogic/Eff/arcturus_Cijk_Ailk_Bjlk_HH.yaml
- {MinimumRequiredVersion: 4.20.0}
- arcturus
- gfx908
- [Device 7380, Device 7388, Device 738c, Device 7390]
- - - [64, 1280, 64, 192]
    - [24, 30.786]
  - - [64, 1280, 64, 320]
    - [29, 36.093]
  - - [64, 1280, 64, 384]
    - [29, 39.089]
  - - [64, 1280, 64, 448]
    - [29, 41.086]
  - - [64, 2048, 64, 192]
    - [23, 31.271]
  - - [64, 2048, 64, 320]
    - [33, 38.294]
  - - [64, 2048, 64, 384]
    - [29, 40.141]
  - - [64, 2048, 64, 448]
    - [26, 41.819]
  - - [1225, 192, 64, 32]
    - [9, 11.529]
  - - [1225, 192, 64, 48]
    - [9, 10.062]
  - - [1225, 192, 64, 64]
    - [0, 18.14]
  - - [1225, 256, 64, 48]
    - [10, 10.901]
  - - [1225, 256, 64, 64]
    - [3, 18.437]
  - - [1225, 288, 64, 48]
    - [1, 9.65]
  - - [1225, 288, 64, 64]
    - [3, 16.492]
  - - [5329, 64, 64, 80]
    - [1, 13.147]
  - - [289, 768, 64, 128]
    - [6, 22.87]
  - - [289, 768, 64, 160]
    - [6, 26.002]
  - - [289, 768, 64, 192]
    - [6, 29.103]
  - - [64, 1280, 32, 192]
    - [12, 23.909]
  - - [64, 1280, 32, 320]
    - [31, 30.311]
  - - [64, 1280, 32, 384]
    - [27, 32.042]
  - - [64, 1280, 32, 448]
    - [35, 33.204]
  - - [64, 2048, 32, 192]
    - [22, 26.259]
  - - [64, 2048, 32, 320]
    - [29, 31.88]
  - - [64, 2048, 32, 384]
    - [29, 33.871]
  - - [64, 2048, 32, 448]
    - [26, 35.169]
  - - [1225, 192, 32, 32]
    - [9, 9.313]
  - - [1225, 192, 32, 48]
    - [9, 8.759]
  - - [1225, 192, 32, 64]
    - [3, 15.281]
  - - [1225, 256, 32, 48]
    - [9, 9.778]
  - - [1225, 256, 32, 64]
    - [5, 16.603]
  - - [1225, 288, 32, 48]
    - [9, 9.039]
  - - [1225, 288, 32, 64]
    - [3, 14.993]
  - - [5329, 64, 32, 80]
    - [1, 12.195]
  - - [289, 768, 32, 128]
    - [9, 20.451]
  - - [289, 768, 32, 160]
    - [3, 22.676]
  - - [289, 768, 32, 192]
    - [2, 24.495]
  - - [3136, 64, 64, 256]
    - [27, 30.229]
  - - [3136, 64, 64, 64]
    - [13, 18.274]
  - - [3136, 256, 64, 64]
    - [25, 26.806]
  - - [784, 128, 64, 512]
    - [28, 42.505]
  - - [784, 512, 64, 128]
    - [28, 33.449]
  - - [196, 256, 64, 1024]
    - [15, 44.406]
  - - [196, 1024, 64, 256]
    - [21, 34.004]
  - - [49, 512, 64, 2048]
    - [5, 25.903]
  - - [49, 2048, 64, 512]
    - [7, 27.354]
  - - [3136, 64, 32, 256]
    - [22, 27.975]
  - - [3136, 64, 32, 64]
    - [31, 14.571]
  - - [3136, 256, 32, 64]
    - [24, 23.563]
  - - [784, 128, 32, 512]
    - [36, 37.898]
  - - [784, 512, 32, 128]
    - [32, 27.476]
  - - [196, 256, 32, 1024]
    - [16, 33.966]
  - - [196, 1024, 32, 256]
    - [18, 28.814]
  - - [49, 512, 32, 2048]
    - [11, 24.385]
  - - [49, 2048, 32, 512]
    - [0, 23.138]
  - - [3136, 64, 64, 128]
    - [34, 23.242]
  - - [3136, 128, 64, 256]
    - [28, 45.056]
  - - [784, 256, 64, 512]
    - [25, 53.241]
  - - [3136, 256, 64, 128]
    - [25, 42.04]
  - - [3136, 256, 64, 256]
    - [25, 57.173]
  - - [196, 512, 64, 1024]
    - [20, 51.246]
  - - [784, 512, 64, 256]
    - [28, 47.526]
  - - [784, 512, 64, 512]
    - [25, 57.817]
  - - [196, 1024, 64, 512]
    - [18, 43.65]
  - - [196, 1024, 64, 1024]
    - [17, 54.83]
  - - [49, 1024, 64, 2048]
    - [4, 32.41]
  - - [49, 2048, 64, 1024]
    - [4, 33.377]
  - - [3136, 64, 32, 128]
    - [30, 20.245]
  - - [3136, 128, 32, 256]
    - [25, 39.453]
  - - [784, 256, 32, 512]
    - [25, 45.122]
  - - [3136, 256, 32, 128]
    - [25, 35.825]
  - - [3136, 256, 32, 256]
    - [25, 52.158]
  - - [196, 512, 32, 1024]
    - [14, 44.342]
  - - [784, 512, 32, 256]
    - [25, 42.098]
  - - [784, 512, 32, 512]
    - [25, 53.799]
  - - [196, 1024, 32, 512]
    - [20, 40.122]
  - - [196, 1024, 32, 1024]
    - [19, 50.407]
  - - [49, 1024, 32, 2048]
    - [8, 25.39]
  - - [49, 2048, 32, 1024]
    - [4, 28.232]
- null
