0702ConvData/LibraryLogic/Eff/arcturus_Cijk_Ailk_Bljk_HH.yaml
- {MinimumRequiredVersion: 4.20.0}
- arcturus
- gfx908
- [Device 7380, Device 7388, Device 738c, Device 7390]
- - - [64, 192, 64, 1280]
    - [30, 30.001]
  - - [64, 320, 64, 1280]
    - [46, 36.344]
  - - [64, 384, 64, 1280]
    - [39, 41.317]
  - - [64, 448, 64, 1280]
    - [48, 41.789]
  - - [64, 192, 64, 2048]
    - [49, 32.625]
  - - [64, 320, 64, 2048]
    - [47, 39.191]
  - - [64, 384, 64, 2048]
    - [35, 40.194]
  - - [64, 448, 64, 2048]
    - [48, 45.032]
  - - [1225, 32, 64, 192]
    - [18, 13.142]
  - - [1225, 48, 64, 192]
    - [7, 13.155]
  - - [1225, 64, 64, 192]
    - [15, 19.771]
  - - [1225, 48, 64, 256]
    - [15, 15.817]
  - - [1225, 64, 64, 256]
    - [8, 23.028]
  - - [1225, 48, 64, 288]
    - [13, 16.228]
  - - [1225, 64, 64, 288]
    - [21, 24.768]
  - - [5329, 80, 64, 64]
    - [3, 11.989]
  - - [289, 128, 64, 768]
    - [20, 29.137]
  - - [289, 160, 64, 768]
    - [5, 26.587]
  - - [289, 192, 64, 768]
    - [14, 31.202]
  - - [64, 192, 32, 1280]
    - [37, 22.113]
  - - [64, 320, 32, 1280]
    - [32, 28.756]
  - - [64, 384, 32, 1280]
    - [38, 32.71]
  - - [64, 448, 32, 1280]
    - [43, 34.238]
  - - [64, 192, 32, 2048]
    - [22, 22.363]
  - - [64, 320, 32, 2048]
    - [50, 28.941]
  - - [64, 384, 32, 2048]
    - [40, 31.533]
  - - [64, 448, 32, 2048]
    - [51, 37.655]
  - - [1225, 32, 32, 192]
    - [11, 11.158]
  - - [1225, 48, 32, 192]
    - [7, 12.25]
  - - [1225, 64, 32, 192]
    - [10, 17.338]
  - - [1225, 48, 32, 256]
    - [4, 12.843]
  - - [1225, 64, 32, 256]
    - [14, 18.55]
  - - [1225, 48, 32, 288]
    - [1, 13.781]
  - - [1225, 64, 32, 288]
    - [16, 20.124]
  - - [5329, 80, 32, 64]
    - [1, 11.239]
  - - [289, 128, 32, 768]
    - [3, 26.422]
  - - [289, 160, 32, 768]
    - [6, 21.882]
  - - [289, 192, 32, 768]
    - [0, 24.401]
  - - [3136, 256, 64, 64]
    - [35, 24.658]
  - - [3136, 64, 64, 64]
    - [34, 16.197]
  - - [3136, 64, 64, 256]
    - [36, 28.923]
  - - [784, 512, 64, 128]
    - [35, 29.224]
  - - [784, 128, 64, 512]
    - [42, 36.077]
  - - [196, 1024, 64, 256]
    - [29, 32.089]
  - - [196, 256, 64, 1024]
    - [25, 44.406]
  - - [49, 2048, 64, 512]
    - [2, 26.415]
  - - [49, 512, 64, 2048]
    - [2, 24.346]
  - - [3136, 256, 32, 64]
    - [35, 22.863]
  - - [3136, 64, 32, 64]
    - [31, 14.142]
  - - [3136, 64, 32, 256]
    - [33, 25.991]
  - - [784, 512, 32, 128]
    - [35, 27.042]
  - - [784, 128, 32, 512]
    - [44, 31.53]
  - - [196, 1024, 32, 256]
    - [26, 28.336]
  - - [196, 256, 32, 1024]
    - [24, 32.19]
  - - [49, 2048, 32, 512]
    - [9, 22.728]
  - - [49, 512, 32, 2048]
    - [5, 21.282]
  - - [3136, 128, 64, 64]
    - [35, 21.52]
  - - [3136, 256, 64, 128]
    - [34, 34.558]
  - - [784, 512, 64, 256]
    - [35, 39.127]
  - - [3136, 128, 64, 256]
    - [34, 39.631]
  - - [3136, 256, 64, 256]
    - [34, 43.45]
  - - [196, 1024, 64, 512]
    - [27, 42.358]
  - - [784, 256, 64, 512]
    - [45, 42.358]
  - - [784, 512, 64, 512]
    - [45, 51.439]
  - - [196, 512, 64, 1024]
    - [28, 49.041]
  - - [196, 1024, 64, 1024]
    - [28, 52.672]
  - - [49, 2048, 64, 1024]
    - [17, 30.85]
  - - [49, 1024, 64, 2048]
    - [12, 29.906]
  - - [3136, 128, 32, 64]
    - [41, 19.33]
  - - [3136, 256, 32, 128]
    - [34, 32.461]
  - - [784, 512, 32, 256]
    - [35, 36.679]
  - - [3136, 128, 32, 256]
    - [34, 36.077]
  - - [3136, 256, 32, 256]
    - [34, 42.3]
  - - [196, 1024, 32, 512]
    - [23, 36.811]
  - - [784, 256, 32, 512]
    - [45, 39.402]
  - - [784, 512, 32, 512]
    - [45, 43.191]
  - - [196, 512, 32, 1024]
    - [28, 44.47]
  - - [196, 1024, 32, 1024]
    - [23, 49.755]
  - - [49, 2048, 32, 1024]
    - [19, 26.971]
  - - [49, 1024, 32, 2048]
    - [17, 23.8]
- null
