0702ConvData/LibraryLogic/Eff/arcturus_Cijk_Ailk_Bjlk_BH.yaml
- {MinimumRequiredVersion: 4.20.0}
- arcturus
- gfx908
- [Device 7380, Device 7388, Device 738c, Device 7390]
- - - [64, 1280, 64, 192]
    - [23, 56.409]
  - - [64, 1280, 64, 320]
    - [23, 66.811]
  - - [64, 1280, 64, 384]
    - [28, 69.396]
  - - [64, 1280, 64, 448]
    - [23, 72.306]
  - - [64, 2048, 64, 192]
    - [11, 59.813]
  - - [64, 2048, 64, 320]
    - [29, 67.079]
  - - [64, 2048, 64, 384]
    - [30, 71.266]
  - - [64, 2048, 64, 448]
    - [29, 73.042]
  - - [1225, 192, 64, 32]
    - [8, 20.87]
  - - [1225, 192, 64, 48]
    - [4, 19.021]
  - - [1225, 192, 64, 64]
    - [5, 33.391]
  - - [1225, 256, 64, 48]
    - [7, 19.685]
  - - [1225, 256, 64, 64]
    - [8, 34.15]
  - - [1225, 288, 64, 48]
    - [1, 18.047]
  - - [1225, 288, 64, 64]
    - [0, 31.017]
  - - [5329, 64, 64, 80]
    - [0, 24.931]
  - - [289, 768, 64, 128]
    - [2, 43.463]
  - - [289, 768, 64, 160]
    - [5, 47.057]
  - - [289, 768, 64, 192]
    - [3, 50.442]
  - - [64, 1280, 32, 192]
    - [23, 45.074]
  - - [64, 1280, 32, 320]
    - [21, 56.274]
  - - [64, 1280, 32, 384]
    - [28, 59.622]
  - - [64, 1280, 32, 448]
    - [21, 61.918]
  - - [64, 2048, 32, 192]
    - [27, 50.075]
  - - [64, 2048, 32, 320]
    - [20, 58.694]
  - - [64, 2048, 32, 384]
    - [10, 60.9]
  - - [64, 2048, 32, 448]
    - [25, 63.483]
  - - [1225, 192, 32, 32]
    - [2, 16.884]
  - - [1225, 192, 32, 48]
    - [5, 16.215]
  - - [1225, 192, 32, 64]
    - [0, 28.262]
  - - [1225, 256, 32, 48]
    - [4, 17.782]
  - - [1225, 256, 32, 64]
    - [2, 30.355]
  - - [1225, 288, 32, 48]
    - [4, 16.793]
  - - [1225, 288, 32, 64]
    - [0, 27.999]
  - - [5329, 64, 32, 80]
    - [1, 23.445]
  - - [289, 768, 32, 128]
    - [5, 38.672]
  - - [289, 768, 32, 160]
    - [8, 43.408]
  - - [289, 768, 32, 192]
    - [8, 47.004]
  - - [3136, 64, 64, 256]
    - [20, 57.954]
  - - [3136, 64, 64, 64]
    - [23, 33.966]
  - - [3136, 256, 64, 64]
    - [23, 46.946]
  - - [784, 128, 64, 512]
    - [29, 70.179]
  - - [784, 512, 64, 128]
    - [24, 53.799]
  - - [196, 256, 64, 1024]
    - [13, 65.267]
  - - [196, 1024, 64, 256]
    - [15, 57.574]
  - - [49, 512, 64, 2048]
    - [0, 50.201]
  - - [49, 2048, 64, 512]
    - [2, 49.755]
  - - [3136, 64, 32, 256]
    - [10, 52.875]
  - - [3136, 64, 32, 64]
    - [12, 26.437]
  - - [3136, 256, 32, 64]
    - [23, 43.836]
  - - [784, 128, 32, 512]
    - [32, 61.424]
  - - [784, 512, 32, 128]
    - [28, 50.201]
  - - [196, 256, 32, 1024]
    - [14, 58.504]
  - - [196, 1024, 32, 256]
    - [17, 51.203]
  - - [49, 512, 32, 2048]
    - [5, 39.504]
  - - [49, 2048, 32, 512]
    - [5, 45.188]
  - - [3136, 64, 64, 128]
    - [26, 43.343]
  - - [3136, 128, 64, 256]
    - [23, 74.108]
  - - [784, 256, 64, 512]
    - [25, 75.611]
  - - [3136, 256, 64, 128]
    - [22, 66.862]
  - - [3136, 256, 64, 256]
    - [24, 81.385]
  - - [196, 512, 64, 1024]
    - [16, 74.602]
  - - [784, 512, 64, 256]
    - [24, 69.821]
  - - [784, 512, 64, 512]
    - [31, 79.801]
  - - [196, 1024, 64, 512]
    - [19, 72.45]
  - - [196, 1024, 64, 1024]
    - [18, 80.744]
  - - [49, 1024, 64, 2048]
    - [9, 56.83]
  - - [49, 2048, 64, 1024]
    - [3, 57.066]
  - - [3136, 64, 32, 128]
    - [23, 37.712]
  - - [3136, 128, 32, 256]
    - [23, 70.42]
  - - [784, 256, 32, 512]
    - [25, 70.339]
  - - [3136, 256, 32, 128]
    - [23, 60.998]
  - - [3136, 256, 32, 256]
    - [28, 74.108]
  - - [196, 512, 32, 1024]
    - [19, 65.544]
  - - [784, 512, 32, 256]
    - [25, 63.978]
  - - [784, 512, 32, 512]
    - [31, 75.195]
  - - [196, 1024, 32, 512]
    - [17, 63.845]
  - - [196, 1024, 32, 1024]
    - [17, 72.967]
  - - [49, 1024, 32, 2048]
    - [6, 49.715]
  - - [49, 2048, 32, 1024]
    - [4, 51.589]
- null
