0701ConvData/LibraryLogic/arcturus_Cijk_Ailk_Bljk_BH.yaml
- {MinimumRequiredVersion: 4.20.0}
- arcturus
- gfx908
- [Device 7380, Device 7388, Device 738c, Device 7390]
- - - [784, 512, 32, 128]
    - [12, 32063.0]
  - - [5329, 80, 64, 64]
    - [9, 14360.0]
  - - [49, 2048, 64, 1024]
    - [18, 38832.0]
  - - [1225, 48, 64, 256]
    - [8, 18527.0]
  - - [784, 128, 64, 512]
    - [13, 42507.0]
  - - [196, 256, 32, 1024]
    - [34, 36505.0]
  - - [1225, 48, 32, 256]
    - [20, 15887.0]
  - - [64, 448, 64, 2048]
    - [38, 50081.0]
  - - [64, 448, 32, 2048]
    - [33, 41352.0]
  - - [196, 1024, 32, 256]
    - [31, 32778.0]
  - - [289, 192, 32, 768]
    - [19, 29039.0]
  - - [3136, 64, 32, 256]
    - [10, 32365.0]
  - - [64, 192, 32, 1280]
    - [3, 25891.0]
  - - [1225, 64, 32, 192]
    - [23, 21201.0]
  - - [784, 128, 32, 512]
    - [8, 38059.0]
  - - [64, 384, 64, 1280]
    - [12, 43092.0]
  - - [3136, 128, 64, 64]
    - [12, 25884.0]
  - - [784, 512, 64, 128]
    - [12, 35042.0]
  - - [5329, 80, 32, 64]
    - [9, 13424.0]
  - - [196, 512, 64, 1024]
    - [35, 48019.0]
  - - [196, 1024, 32, 512]
    - [37, 41943.0]
  - - [49, 1024, 64, 2048]
    - [7, 36167.0]
  - - [1225, 32, 64, 192]
    - [9, 16273.0]
  - - [1225, 48, 64, 192]
    - [9, 16391.0]
  - - [289, 160, 32, 768]
    - [4, 26452.0]
  - - [784, 512, 32, 256]
    - [12, 43041.0]
  - - [3136, 64, 64, 256]
    - [10, 36602.0]
  - - [64, 448, 32, 1280]
    - [27, 36792.0]
  - - [49, 512, 32, 2048]
    - [24, 21771.0]
  - - [196, 1024, 64, 256]
    - [36, 35836.0]
  - - [64, 320, 32, 2048]
    - [30, 31775.0]
  - - [64, 192, 64, 2048]
    - [30, 37421.0]
  - - [196, 512, 32, 1024]
    - [35, 42288.0]
  - - [1225, 64, 32, 288]
    - [0, 25513.0]
  - - [49, 2048, 32, 512]
    - [18, 27330.0]
  - - [3136, 256, 32, 128]
    - [12, 37954.0]
  - - [1225, 64, 64, 192]
    - [19, 23989.0]
  - - [3136, 256, 32, 64]
    - [12, 27007.0]
  - - [49, 2048, 32, 1024]
    - [25, 33337.0]
  - - [289, 160, 64, 768]
    - [6, 30680.0]
  - - [784, 512, 64, 256]
    - [12, 46315.0]
  - - [289, 128, 32, 768]
    - [6, 27853.0]
  - - [1225, 48, 64, 288]
    - [26, 19749.0]
  - - [196, 256, 64, 1024]
    - [35, 42115.0]
  - - [1225, 48, 32, 192]
    - [9, 14567.0]
  - - [64, 192, 64, 1280]
    - [11, 36054.0]
  - - [196, 1024, 64, 1024]
    - [37, 50434.0]
  - - [64, 384, 32, 2048]
    - [1, 37561.0]
  - - [49, 2048, 64, 512]
    - [18, 32493.0]
  - - [64, 320, 64, 1280]
    - [12, 35849.0]
  - - [3136, 128, 32, 256]
    - [13, 43405.0]
  - - [196, 1024, 32, 1024]
    - [37, 48443.0]
  - - [289, 192, 64, 768]
    - [16, 37300.0]
  - - [3136, 256, 64, 256]
    - [13, 50761.0]
  - - [1225, 64, 32, 256]
    - [8, 22551.0]
  - - [3136, 256, 32, 256]
    - [12, 48788.0]
  - - [64, 320, 32, 1280]
    - [29, 30218.0]
  - - [784, 512, 32, 512]
    - [12, 49884.0]
  - - [289, 128, 64, 768]
    - [25, 34436.0]
  - - [3136, 256, 64, 64]
    - [12, 29571.0]
  - - [3136, 64, 64, 64]
    - [28, 18995.0]
  - - [3136, 128, 64, 256]
    - [13, 47030.0]
  - - [1225, 64, 64, 256]
    - [19, 28368.0]
  - - [784, 256, 32, 512]
    - [38, 44923.0]
  - - [1225, 48, 32, 288]
    - [9, 16850.0]
  - - [784, 512, 64, 512]
    - [12, 52395.0]
  - - [3136, 64, 32, 64]
    - [22, 16736.0]
  - - [3136, 256, 64, 128]
    - [13, 40839.0]
  - - [3136, 128, 32, 64]
    - [12, 22938.0]
  - - [196, 1024, 64, 512]
    - [35, 44437.0]
  - - [64, 384, 64, 2048]
    - [32, 43719.0]
  - - [64, 192, 32, 2048]
    - [14, 27429.0]
  - - [784, 256, 64, 512]
    - [12, 49109.0]
  - - [49, 512, 64, 2048]
    - [5, 28545.0]
  - - [64, 448, 64, 1280]
    - [32, 47127.0]
  - - [1225, 64, 64, 288]
    - [19, 29515.0]
  - - [49, 1024, 32, 2048]
    - [17, 28367.0]
  - - [1225, 32, 32, 192]
    - [15, 13622.0]
  - - [64, 320, 64, 2048]
    - [2, 37617.0]
  - - [64, 384, 32, 1280]
    - [21, 34664.0]
- null
