0701ConvData/LibraryLogic/arcturus_Cijk_Ailk_Bjlk_HH.yaml
- {MinimumRequiredVersion: 4.20.0}
- arcturus
- gfx908
- [Device 7380, Device 7388, Device 738c, Device 7390]
- - - [784, 128, 32, 512]
    - [15, 52031.0]
  - - [289, 768, 64, 160]
    - [31, 39240.0]
  - - [49, 2048, 64, 1024]
    - [33, 43798.0]
  - - [64, 2048, 64, 192]
    - [32, 43672.0]
  - - [196, 1024, 32, 256]
    - [44, 37780.0]
  - - [1225, 192, 64, 48]
    - [17, 21555.0]
  - - [3136, 256, 64, 128]
    - [6, 58595.0]
  - - [3136, 64, 32, 128]
    - [3, 30313.0]
  - - [196, 512, 64, 1024]
    - [44, 67439.0]
  - - [64, 1280, 32, 448]
    - [13, 49262.0]
  - - [3136, 256, 32, 256]
    - [14, 73597.0]
  - - [196, 256, 32, 1024]
    - [43, 44293.0]
  - - [784, 256, 64, 512]
    - [15, 73009.0]
  - - [289, 768, 32, 192]
    - [31, 37964.0]
  - - [3136, 64, 32, 256]
    - [3, 39297.0]
  - - [3136, 64, 64, 64]
    - [18, 24066.0]
  - - [1225, 192, 64, 32]
    - [19, 16317.0]
  - - [49, 2048, 32, 512]
    - [25, 31187.0]
  - - [1225, 192, 32, 64]
    - [24, 21737.0]
  - - [64, 2048, 32, 448]
    - [40, 45344.0]
  - - [784, 512, 64, 128]
    - [37, 47796.0]
  - - [784, 128, 64, 512]
    - [15, 60536.0]
  - - [289, 768, 32, 160]
    - [30, 33189.0]
  - - [64, 2048, 64, 320]
    - [38, 50610.0]
  - - [1225, 288, 64, 64]
    - [17, 22865.0]
  - - [64, 1280, 32, 320]
    - [4, 42625.0]
  - - [784, 512, 32, 512]
    - [15, 72239.0]
  - - [784, 512, 32, 256]
    - [28, 58221.0]
  - - [64, 1280, 64, 192]
    - [26, 40721.0]
  - - [3136, 256, 32, 64]
    - [11, 35496.0]
  - - [64, 1280, 32, 384]
    - [10, 46261.0]
  - - [196, 256, 64, 1024]
    - [45, 60359.0]
  - - [1225, 256, 32, 64]
    - [34, 23965.0]
  - - [1225, 192, 32, 32]
    - [0, 12921.0]
  - - [3136, 256, 32, 128]
    - [11, 51252.0]
  - - [784, 512, 64, 512]
    - [2, 76902.0]
  - - [196, 1024, 32, 512]
    - [44, 53801.0]
  - - [64, 2048, 64, 448]
    - [46, 55791.0]
  - - [49, 2048, 32, 1024]
    - [23, 37098.0]
  - - [289, 768, 32, 128]
    - [16, 29289.0]
  - - [784, 512, 64, 256]
    - [14, 65245.0]
  - - [49, 512, 32, 2048]
    - [7, 29318.0]
  - - [49, 1024, 64, 2048]
    - [8, 43313.0]
  - - [64, 1280, 64, 448]
    - [13, 55188.0]
  - - [196, 1024, 64, 256]
    - [31, 43774.0]
  - - [1225, 288, 32, 48]
    - [24, 16977.0]
  - - [3136, 64, 64, 256]
    - [12, 41646.0]
  - - [196, 1024, 64, 512]
    - [41, 56735.0]
  - - [196, 1024, 64, 1024]
    - [42, 72494.0]
  - - [64, 2048, 32, 384]
    - [29, 43958.0]
  - - [49, 512, 64, 2048]
    - [25, 37780.0]
  - - [3136, 128, 32, 256]
    - [14, 56539.0]
  - - [64, 2048, 32, 192]
    - [36, 34832.0]
  - - [5329, 64, 64, 80]
    - [0, 26078.0]
  - - [196, 1024, 32, 1024]
    - [39, 66404.0]
  - - [3136, 256, 64, 256]
    - [14, 78518.0]
  - - [5329, 64, 32, 80]
    - [24, 23122.0]
  - - [64, 2048, 32, 320]
    - [38, 41528.0]
  - - [289, 768, 64, 192]
    - [20, 43374.0]
  - - [196, 512, 32, 1024]
    - [45, 60182.0]
  - - [3136, 64, 64, 128]
    - [22, 32831.0]
  - - [289, 768, 64, 128]
    - [20, 34966.0]
  - - [3136, 256, 64, 64]
    - [11, 39259.0]
  - - [3136, 128, 64, 256]
    - [5, 63777.0]
  - - [1225, 192, 64, 64]
    - [19, 25676.0]
  - - [784, 256, 32, 512]
    - [47, 61258.0]
  - - [1225, 288, 64, 48]
    - [17, 19271.0]
  - - [64, 1280, 64, 320]
    - [35, 49578.0]
  - - [3136, 64, 32, 64]
    - [12, 20718.0]
  - - [64, 2048, 64, 384]
    - [29, 53544.0]
  - - [784, 512, 32, 128]
    - [21, 41104.0]
  - - [1225, 256, 64, 64]
    - [10, 28022.0]
  - - [64, 1280, 32, 192]
    - [27, 34953.0]
  - - [1225, 256, 32, 48]
    - [10, 19741.0]
  - - [64, 1280, 64, 384]
    - [27, 54708.0]
  - - [1225, 256, 64, 48]
    - [1, 23248.0]
  - - [49, 2048, 64, 512]
    - [33, 36472.0]
  - - [1225, 288, 32, 64]
    - [19, 20480.0]
  - - [1225, 192, 32, 48]
    - [17, 17849.0]
  - - [49, 1024, 32, 2048]
    - [9, 34225.0]
- null
