0701ConvData/LibraryLogic/arcturus_Cijk_Ailk_Bljk_HH.yaml
- {MinimumRequiredVersion: 4.20.0}
- arcturus
- gfx908
- [Device 7380, Device 7388, Device 738c, Device 7390]
- - - [784, 512, 32, 128]
    - [15, 35132.0]
  - - [5329, 80, 64, 64]
    - [6, 16133.0]
  - - [49, 2048, 64, 1024]
    - [31, 40577.0]
  - - [1225, 48, 64, 256]
    - [20, 20445.0]
  - - [784, 128, 64, 512]
    - [1, 46762.0]
  - - [196, 256, 32, 1024]
    - [37, 42115.0]
  - - [1225, 48, 32, 256]
    - [7, 16142.0]
  - - [64, 448, 64, 2048]
    - [44, 53749.0]
  - - [64, 448, 32, 2048]
    - [45, 44910.0]
  - - [196, 1024, 32, 256]
    - [33, 33310.0]
  - - [289, 192, 32, 768]
    - [1, 32102.0]
  - - [3136, 64, 32, 256]
    - [13, 34368.0]
  - - [64, 192, 32, 1280]
    - [17, 26324.0]
  - - [1225, 64, 32, 192]
    - [35, 22136.0]
  - - [784, 128, 32, 512]
    - [9, 40617.0]
  - - [64, 384, 64, 1280]
    - [23, 52429.0]
  - - [3136, 128, 64, 64]
    - [15, 29872.0]
  - - [784, 512, 64, 128]
    - [12, 38379.0]
  - - [5329, 80, 32, 64]
    - [6, 14669.0]
  - - [196, 512, 64, 1024]
    - [39, 64833.0]
  - - [196, 1024, 32, 512]
    - [36, 49168.0]
  - - [49, 1024, 64, 2048]
    - [18, 40477.0]
  - - [1225, 32, 64, 192]
    - [5, 16866.0]
  - - [1225, 48, 64, 192]
    - [10, 16850.0]
  - - [289, 160, 32, 768]
    - [27, 27476.0]
  - - [784, 512, 32, 256]
    - [15, 48415.0]
  - - [3136, 64, 64, 256]
    - [34, 38201.0]
  - - [64, 448, 32, 1280]
    - [38, 39463.0]
  - - [49, 512, 32, 2048]
    - [28, 27661.0]
  - - [196, 1024, 64, 256]
    - [30, 37745.0]
  - - [64, 320, 32, 2048]
    - [0, 36080.0]
  - - [64, 192, 64, 2048]
    - [14, 40105.0]
  - - [196, 512, 32, 1024]
    - [36, 60270.0]
  - - [1225, 64, 32, 288]
    - [2, 26255.0]
  - - [49, 2048, 32, 512]
    - [8, 30224.0]
  - - [3136, 256, 32, 128]
    - [12, 42332.0]
  - - [1225, 64, 64, 192]
    - [9, 26880.0]
  - - [3136, 256, 32, 64]
    - [15, 31329.0]
  - - [49, 2048, 32, 1024]
    - [31, 36088.0]
  - - [289, 160, 64, 768]
    - [6, 35031.0]
  - - [784, 512, 64, 256]
    - [12, 51477.0]
  - - [289, 128, 32, 768]
    - [9, 33922.0]
  - - [1225, 48, 64, 288]
    - [6, 21368.0]
  - - [196, 256, 64, 1024]
    - [43, 58470.0]
  - - [1225, 48, 32, 192]
    - [10, 14953.0]
  - - [64, 192, 64, 1280]
    - [25, 37673.0]
  - - [196, 1024, 64, 1024]
    - [43, 69609.0]
  - - [64, 384, 32, 2048]
    - [29, 40508.0]
  - - [49, 2048, 64, 512]
    - [19, 34953.0]
  - - [64, 320, 64, 1280]
    - [40, 46811.0]
  - - [3136, 128, 32, 256]
    - [13, 48075.0]
  - - [196, 1024, 32, 1024]
    - [36, 65872.0]
  - - [289, 192, 64, 768]
    - [32, 41223.0]
  - - [3136, 256, 64, 256]
    - [13, 58511.0]
  - - [1225, 64, 32, 256]
    - [9, 24778.0]
  - - [3136, 256, 32, 256]
    - [24, 55772.0]
  - - [64, 320, 32, 1280]
    - [16, 34156.0]
  - - [784, 512, 32, 512]
    - [46, 56970.0]
  - - [289, 128, 64, 768]
    - [32, 38262.0]
  - - [3136, 256, 64, 64]
    - [15, 33803.0]
  - - [3136, 64, 64, 64]
    - [13, 21408.0]
  - - [3136, 128, 64, 256]
    - [13, 52429.0]
  - - [1225, 64, 64, 256]
    - [9, 31299.0]
  - - [784, 256, 32, 512]
    - [46, 52031.0]
  - - [1225, 48, 32, 288]
    - [6, 17369.0]
  - - [784, 512, 64, 512]
    - [46, 65453.0]
  - - [3136, 64, 32, 64]
    - [26, 17536.0]
  - - [3136, 256, 64, 128]
    - [13, 45926.0]
  - - [3136, 128, 32, 64]
    - [15, 25884.0]
  - - [196, 1024, 64, 512]
    - [39, 52969.0]
  - - [64, 384, 64, 2048]
    - [22, 52225.0]
  - - [64, 192, 32, 2048]
    - [11, 28118.0]
  - - [784, 256, 64, 512]
    - [41, 55659.0]
  - - [49, 512, 64, 2048]
    - [18, 31814.0]
  - - [64, 448, 64, 1280]
    - [44, 49847.0]
  - - [1225, 64, 64, 288]
    - [4, 32141.0]
  - - [49, 1024, 32, 2048]
    - [3, 31839.0]
  - - [1225, 32, 32, 192]
    - [10, 14474.0]
  - - [64, 320, 64, 2048]
    - [42, 49128.0]
  - - [64, 384, 32, 1280]
    - [21, 36158.0]
- null
