Tensile/Configs/miopen/archives/conv1x1/2020-07-07/exact/arcturus_Cijk_Ailk_Bljk_BH.yaml
- {MinimumRequiredVersion: 4.20.0}
- arcturus
- gfx908
- [Device 7380, Device 7388, Device 738c, Device 7390]
- - - [64, 192, 64, 1280]
    - [33, 55.743]
  - - [64, 320, 64, 1280]
    - [36, 54.328]
  - - [64, 384, 64, 1280]
    - [35, 65.306]
  - - [64, 448, 64, 1280]
    - [42, 71.022]
  - - [64, 192, 64, 2048]
    - [39, 56.986]
  - - [64, 320, 64, 2048]
    - [37, 56.515]
  - - [64, 384, 64, 2048]
    - [35, 67.819]
  - - [64, 448, 64, 2048]
    - [41, 76.125]
  - - [1225, 32, 64, 192]
    - [19, 25.254]
  - - [1225, 48, 64, 192]
    - [2, 25.612]
  - - [1225, 64, 64, 192]
    - [1, 35.848]
  - - [1225, 48, 64, 256]
    - [3, 28.042]
  - - [1225, 64, 64, 256]
    - [15, 41.885]
  - - [1225, 48, 64, 288]
    - [8, 29.963]
  - - [1225, 64, 64, 288]
    - [9, 44.779]
  - - [5329, 80, 64, 64]
    - [4, 22.204]
  - - [289, 128, 64, 768]
    - [13, 51.098]
  - - [289, 160, 64, 768]
    - [12, 46.798]
  - - [289, 192, 64, 768]
    - [12, 56.656]
  - - [64, 192, 32, 1280]
    - [30, 41.869]
  - - [64, 320, 32, 1280]
    - [21, 48.31]
  - - [64, 384, 32, 1280]
    - [33, 55.415]
  - - [64, 448, 32, 1280]
    - [29, 59.73]
  - - [64, 192, 32, 2048]
    - [20, 42.942]
  - - [64, 320, 32, 2048]
    - [45, 50.444]
  - - [64, 384, 32, 2048]
    - [40, 57.42]
  - - [64, 448, 32, 2048]
    - [44, 65.128]
  - - [1225, 32, 32, 192]
    - [11, 21.569]
  - - [1225, 48, 32, 192]
    - [7, 22.999]
  - - [1225, 64, 32, 192]
    - [0, 32.784]
  - - [1225, 48, 32, 256]
    - [14, 25.043]
  - - [1225, 64, 32, 256]
    - [8, 33.578]
  - - [1225, 48, 32, 288]
    - [7, 26.692]
  - - [1225, 64, 32, 288]
    - [0, 38.639]
  - - [5329, 80, 32, 64]
    - [4, 20.924]
  - - [289, 128, 32, 768]
    - [8, 43.968]
  - - [289, 160, 32, 768]
    - [17, 40.283]
  - - [289, 192, 32, 768]
    - [16, 44.778]
  - - [3136, 256, 64, 64]
    - [32, 44.025]
  - - [3136, 64, 64, 64]
    - [28, 28.815]
  - - [3136, 64, 64, 256]
    - [34, 55.298]
  - - [784, 512, 64, 128]
    - [35, 52.694]
  - - [784, 128, 64, 512]
    - [43, 65.685]
  - - [196, 1024, 64, 256]
    - [27, 59.696]
  - - [196, 256, 64, 1024]
    - [23, 64.179]
  - - [49, 2048, 64, 512]
    - [10, 48.846]
  - - [49, 512, 64, 2048]
    - [6, 43.282]
  - - [3136, 256, 32, 64]
    - [35, 40.385]
  - - [3136, 64, 32, 64]
    - [21, 26.079]
  - - [3136, 64, 32, 256]
    - [22, 48.924]
  - - [784, 512, 32, 128]
    - [32, 47.784]
  - - [784, 128, 32, 512]
    - [34, 57.954]
  - - [196, 1024, 32, 256]
    - [27, 54.084]
  - - [196, 256, 32, 1024]
    - [26, 57.628]
  - - [49, 2048, 32, 512]
    - [13, 42.8]
  - - [49, 512, 32, 2048]
    - [18, 32.843]
  - - [3136, 128, 64, 64]
    - [38, 38.66]
  - - [3136, 256, 64, 128]
    - [34, 61.21]
  - - [784, 512, 64, 256]
    - [32, 69.038]
  - - [3136, 128, 64, 256]
    - [34, 70.947]
  - - [3136, 256, 64, 256]
    - [34, 76.243]
  - - [196, 1024, 64, 512]
    - [27, 70.581]
  - - [784, 256, 64, 512]
    - [35, 73.664]
  - - [784, 512, 64, 512]
    - [35, 78.228]
  - - [196, 512, 64, 1024]
    - [24, 73.052]
  - - [196, 1024, 64, 1024]
    - [25, 76.837]
  - - [49, 2048, 64, 1024]
    - [5, 56.542]
  - - [49, 1024, 64, 2048]
    - [13, 54.394]
  - - [3136, 128, 32, 64]
    - [38, 33.305]
  - - [3136, 256, 32, 128]
    - [32, 57.845]
  - - [784, 512, 32, 256]
    - [35, 64.787]
  - - [3136, 128, 32, 256]
    - [31, 64.514]
  - - [3136, 256, 32, 256]
    - [34, 73.052]
  - - [196, 1024, 32, 512]
    - [25, 65.544]
  - - [784, 256, 32, 512]
    - [46, 69.231]
  - - [784, 512, 32, 512]
    - [32, 75.011]
  - - [196, 512, 32, 1024]
    - [24, 64.447]
  - - [196, 1024, 32, 1024]
    - [25, 73.489]
  - - [49, 2048, 32, 1024]
    - [10, 50.078]
  - - [49, 1024, 32, 2048]
    - [18, 42.741]
- null
